[
  {
    "iso2": "GLOBAL",
    "coverageStatus": "open_dataset_available",
    "adapters": ["geonames_global"],
    "sources": [
      {
        "id": "geonames",
        "type": "open_dataset",
        "url": "https://www.geonames.org/export/zip/",
        "license": "CC-BY 4.0",
        "redistributable": true,
        "confidence": 0.7,
        "notes": "Primary open baseline for global postal codes."
      }
    ],
    "updatedAt": "2026-06-08T00:00:00Z"
  },
  {
    "iso2": "JP",
    "coverageStatus": "official_api_available",
    "adapters": ["jppost_jp"],
    "sources": [
      {
        "id": "jppost_api",
        "type": "official_api",
        "url": "https://lp-api.da.pf.japanpost.jp/",
        "license": "Japan Post Digital Address Terms",
        "redistributable": false,
        "confidence": 1.0,
        "notes": "Official API for postal and digital addresses."
      },
      {
        "id": "jppost_csv",
        "type": "official_download",
        "url": "https://www.post.japanpost.jp/zipcode/download.html",
        "license": "Japan Post Terms",
        "redistributable": true,
        "confidence": 1.0,
        "notes": "Official CSV download."
      }
    ],
    "updatedAt": "2026-06-08T00:00:00Z"
  },
  {
    "iso2": "SUPPLEMENTAL",
    "coverageStatus": "partial_open_dataset",
    "adapters": ["osm_global"],
    "sources": [
      {
        "id": "osm",
        "type": "open_dataset",
        "url": "https://wiki.openstreetmap.org/wiki/Key:postal_code",
        "license": "ODbL",
        "redistributable": true,
        "confidence": 0.5,
        "notes": "Geospatial supplemental data."
      }
    ],
    "updatedAt": "2026-06-08T00:00:00Z"
  }
]
